{"command": "check", "data": {"commands": [{"command": "/Users/almu/Documents/AlmuRepoRoot/Ralphite/.venv/bin/python3 -m compileall src/ralphite", "exit_code": 0, "stderr": "", "stdout": ""}, {"command": "", "cwd": "/Users/almu/Documents/AlmuRepoRoot/Ralphite", "exit_code": 0, "stderr": "skipped by RALPHITE_SKIP_BACKEND_CMD_CHECKS=1", "stdout": "", "suite": "backend-smoke-skipped"}, {"command": "uv run --no-sync pytest tests/engine/test_task_parser.py tests/engine/test_structure_compiler.py -q", "cwd": "/Users/almu/Documents/AlmuRepoRoot/Ralphite", "exit_code": 0, "stderr": "", "stdout": "", "suite": "parser-compiler"}, {"command": "uv run --no-sync pytest tests/engine/test_git_worktree_integration.py tests/engine/test_orchestrator.py tests/engine/test_recovery.py -q", "cwd": "/Users/almu/Documents/AlmuRepoRoot/Ralphite", "exit_code": 0, "stderr": "", "stdout": "", "suite": "engine-runtime"}, {"command": "uv run --no-sync pytest tests/cli -q", "cwd": "/Users/almu/Documents/AlmuRepoRoot/Ralphite", "exit_code": 0, "stderr": "", "stdout": "", "suite": "cli-contract"}, {"command": "uv run --no-sync pytest tests/engine/test_e2e_recovery.py -q", "cwd": "/Users/almu/Documents/AlmuRepoRoot/Ralphite", "exit_code": 0, "stderr": "", "stdout": "", "suite": "e2e-recovery"}, {"command": "uv run --no-sync pytest tests/engine/test_fixture_plan_matrix.py tests/engine/test_dispatched_plan_consistency.py tests/engine/test_examples_plans.py tests/cli/test_bootstrap_e2e.py -q", "cwd": "/Users/almu/Documents/AlmuRepoRoot/Ralphite", "exit_code": 0, "stderr": "", "stdout": "", "suite": "fixtures-bootstrap"}], "doctor": {"checks": [{"check": "cmd:python3", "detail": "/Users/almu/Documents/AlmuRepoRoot/Ralphite/.venv/bin/python3", "status": "OK"}, {"check": "cmd:uv", "detail": "/Users/almu/.local/bin/uv", "status": "OK"}, {"check": "cmd:git", "detail": "/usr/bin/git", "status": "OK"}, {"check": "cmd:rg", "detail": "/opt/homebrew/bin/rg", "status": "OK"}, {"check": "cmd:codex", "detail": "/opt/homebrew/bin/codex", "status": "OK"}, {"check": "cmd:agent", "detail": "/Users/almu/.local/bin/agent", "status": "OK"}, {"check": "config", "detail": "/private/tmp/ralphite-strict-check/.ralphite/config.toml", "status": "OK"}, {"check": "plans", "detail": "1 plan file(s)", "status": "OK"}, {"check": "plan-validation", "detail": "all plans valid", "status": "OK"}, {"check": "tasks", "detail": "embedded YAML tasks parseable", "status": "OK"}, {"check": "orchestration-resolver", "detail": "resolved execution structure is available", "status": "OK"}, {"check": "recovery-readiness", "detail": "git/worktree readiness computed", "status": "OK"}, {"check": "recoverable-runs", "detail": "0", "status": "OK"}, {"check": "stale-artifacts", "detail": "worktrees=0 branches=0", "status": "OK"}], "fix_suggestions": [], "ok": true, "plan_failures": [], "stale_artifacts": {"stale_branches": [], "stale_worktrees": []}}}, "exit_code": 0, "issues": [], "next_actions": [], "ok": true, "run_id": null, "schema_version": "cli-output.v1", "status": "succeeded"}
